{
  "author": "PlayerVox",
  "spdxLicense": "AGPL-3.0-only",
  "sourceUrl": "https://github.com/PlayerVox/playervox-overcrow-marketplace",
  "previewFile": "preview.png",
  "localizations": [
    {
      "locale": "en",
      "name": "Warframe Sortie & Archon Hunt",
      "description": "Tracks public Sortie and Archon Hunt missions with local completion checklists."
    },
    {
      "locale": "fr",
      "name": "Sortie et Chasse à l’Archonte Warframe",
      "description": "Suit les missions publiques de Sortie et de Chasse à l’Archonte avec des checklists de complétion locales."
    }
  ]
}
