{
  "author": "PlayerVox",
  "spdxLicense": "AGPL-3.0-only",
  "sourceUrl": "https://github.com/PlayerVox/playervox-overcrow-marketplace",
  "localizations": [
    {
      "locale": "en",
      "name": "Warframe Void Fissures",
      "description": "Shows active public Void Fissures with local era and mission-source filters."
    },
    {
      "locale": "fr",
      "name": "Fissures du Néant Warframe",
      "description": "Affiche les Fissures du Néant publiques actives avec des filtres locaux par ère et source de mission."
    }
  ]
}
