{
  "author": "PlayerVox",
  "spdxLicense": "AGPL-3.0-only",
  "sourceUrl": "https://github.com/PlayerVox/playervox-overcrow-marketplace",
  "localizations": [
    {
      "locale": "en",
      "name": "Warframe Status",
      "description": "Shows public Warframe cycles, daily reset, and Baro Ki’Teer status."
    },
    {
      "locale": "fr",
      "name": "Statut Warframe",
      "description": "Affiche les cycles publics de Warframe, la réinitialisation quotidienne et le statut de Baro Ki’Teer."
    }
  ]
}
