{
  "author": "PlayerVox",
  "spdxLicense": "AGPL-3.0-only",
  "sourceUrl": "https://github.com/PlayerVox/playervox-overcrow-marketplace",
  "localizations": [
    {
      "locale": "en",
      "name": "Warframe Worldstate Provider",
      "description": "Shares bounded public Warframe world-state data with installed widgets."
    },
    {
      "locale": "fr",
      "name": "Fournisseur d’état mondial Warframe",
      "description": "Partage des données publiques et bornées de l’état mondial de Warframe avec les widgets installés."
    }
  ]
}
